paper_key,key_type,title,abstract,year,authors,url,source,depth,clean_abstract,Topic_r1,Topic_r2,Topic_r3,Topic_final,arxiv_id,doi,is_ml
,,Universality in the resurgence of generalized Tracy-Widom distributions,"We analyze determinants associated with Bessel kernels and generic symbol functions, which govern a class of observables across all values of the 't Hooft coupling in supersymmetric gauge theories. Previous approaches, based on integro-differential equations, have provided systematic strong-coupling expansions for the logarithms of these determinants, expressed through the moments of the symbol. The resulting asymptotic series, once completed with non-perturbative terms, allowed the leading resurgence relations to be tested. In this Letter we focus directly on the determinants themselves, and we uncover a strikingly simple non-perturbative structure: all trans-series corrections share a universal form, while the moments transform in a direct and intuitive way. This simplicity points to an underlying organizing principle for the non-perturbative dynamics of gauge theory observables.",2025,"['Zoltan Bajnok', 'Bercel Boldis', 'Dennis le Plat']",http://arxiv.org/abs/2509.20302v1,arxiv,,,,,,,2509.20302v1,,False
GPU Implementation of Zippel Method for Feynman Integral Reconstruction,unknown,GPU Implementation of Zippel Method for Feynman Integral Reconstruction,"The Zippel algorithm performs a rational reconstruction of multivariate polynomials and aims specifically at the sparse case. It is applied in different fields of science, lately becoming an important step in Feynman integral reduction in elementary particle physics. In some cases with multiple variables it might become a bottleneck for the whole evaluation so that different optimizations are required. In this paper we describe how we ported the classical Zippel algorithm together with its balanced version for rational functions to graphical processor units and perform its evaluation on several GPUs.",2025,"['Smirnov', 'Alexander V.', 'Rozhnov', 'Boris I.', 'Voevodin', 'Vadim V.']",,inspire_citation,3.0,"The Zippel algorithm performs a rational reconstruction of multivariate polynomials and aims specifically at the sparse case. It is applied in different fields of science, lately becoming an important step in Feynman integral reduction in elementary particle physics. In some cases with multiple variables it might become a bottleneck for the whole evaluation so that different optimizations are required. In this paper we describe how we ported the classical Zippel algorithm together with its balanced version for rational functions to graphical processor units and perform its evaluation on several GPUs.",5.0,1.0,1.0,1.0,,,False
,,Performance of heavy-flavour jet identification in Lorentz-boosted   topologies in proton-proton collisions at $\sqrt{s}$ = 13 TeV,"Measurements in the highly Lorentz-boosted regime provoke increased interest in probing the Higgs boson properties and in searching for particles beyond the standard model at the LHC. In the CMS Collaboration, various boosted-object tagging algorithms, designed to identify hadronic jets originating from a massive particle decaying to $\mathrm{b\overline{b}}$ or $\mathrm{c\overline{c}}$, have been developed and deployed across a range of physics analyses. This paper highlights their performance on simulated events, and summarizes novel calibration techniques using proton-proton collision data collected at $\sqrt{s}$ = 13 TeV during the 2016$-$2018 LHC data-taking period. Three dedicated methods are used for the calibration in multijet events, leveraging either machine learning techniques, the presence of muons within energetic boosted jets, or the reconstruction of hadronically decaying high-energy Z bosons. The calibration results, obtained through a combination of these approaches, are presented and discussed.",2025,['CMS Collaboration'],http://arxiv.org/abs/2510.10228v1,arxiv,,,,,,,2510.10228v1,,True
,,Uncovering Singularities in Feynman Integrals via Machine Learning,"We introduce a machine-learning framework based on symbolic regression to extract the full symbol alphabet of multi-loop Feynman integrals. By targeting the analytic structure rather than reduction, the method is broadly applicable and interpretable across different families of integrals. It successfully reconstructs complete symbol alphabets in nontrivial examples, demonstrating both robustness and generality. Beyond accelerating computations case by case, it uncovers the analytic structure universally. This framework opens new avenues for multi-loop amplitude analysis and provides a versatile tool for exploring scattering amplitudes.",2025,"['Yuanche Liu', 'Yingxuan Xu', 'Yang Zhang']",http://arxiv.org/abs/2510.10099v1,arxiv,,,,,,,2510.10099v1,,True
,,Theoretical filters for shift-symmetric Horndeski gravities,"We investigate the structure of nontrivial maximally symmetric vacua and compact-object solutions in shift-symmetric scalar-tensor theories. Focusing on Horndeski gravity, we derive consistency conditions directly from the field equations to identify the subclasses that admit Minkowski and de Sitter vacua with a nontrivial scalar field. In doing so, we obtain a filtering mechanism that operates independently of observational data. In this context, we introduce the notion of stealth vacua, where the scalar field remains active without altering the vacuum. Following this, we examine the theoretical framework of Horndeski theories that admit homogeneous geometries and we extract the implicit form of the solution pertaining to the entire family of theories. Building upon these frameworks, we construct exact solutions in beyond-Horndeski gravity by applying a linear disformal transformation to the regularized Einstein-Gauss-Bonnet black hole. This procedure yields solitonic spacetimes with scalar hair as well as black holes carrying primary scalar hair, demonstrating how disformal maps can qualitatively modify solution properties. We delineate the parameter space in which the transformation is well-defined and analyze the solutions. Our results provide both a principled criterion for selecting viable Horndeski models and a framework for exploring rich solution spaces in beyond-Horndeski gravity.",2025,"['Athanasios Bakopoulos', 'Christos Charmousis', 'Nikos Chatzifotis', 'Theodoros Nakas']",http://arxiv.org/abs/2510.09547v1,arxiv,,,,,,,2510.09547v1,,False
,,Lie symmetry analysis of the two-Higgs-doublet model field equations,"We apply Lie symmetry analysis of partial differential equations (PDEs) to the Euler-Lagrange equations of the two-Higgs-doublet model (2HDM), to determine its scalar Lie point symmetries. A Lie point symmetry is a structure-preserving transformation of the spacetime variables and the fields of the model, which is also continuous and connected to the identity. Symmetries of PDEs may in general be divided into strict variational symmetries, divergence symmetries and non-variational symmetries, where the first two are collectively referred to as variational symmetries. Variational symmetries are usually preserved under quantization, and variational Lie symmetries yield conservation laws. We demonstrate that there are no scalar Lie point divergence symmetries or non-variational Lie point symmetries in the 2HDM, and re-derive its well-known strict variational Lie point symmetries, thus confirming the consistency of our implementation of Lie's method. Moreover, we prove three general results which may simplify Lie symmetry calculations for a wide class of particle physics models. Lie symmetry analysis of PDEs is a broadly applicable method for determining Lie symmetries. As demonstrated here by example, it can be applied to models with many variables, parameters and reparametrization freedom, while any missing discrete symmetries may be identified through the automorphism groups of the resulting Lie symmetry algebras.",2025,['M. Aa. Solberg'],http://arxiv.org/abs/2510.09542v1,arxiv,,,,,,,2510.09542v1,,False
,,Massive Gauge Theories from Consistency Conditions of Amplitudes,"Based on the general principles of Lorentz symmetry and unitary, we introduce two consistency conditions -- on-shell gauge symmetry and strong massive-massless continuation -- in constructing amplitudes of massive gauge theory with elementary particles. In particular we argue on-shell gauge symmtry can be understood as a consequence of Lorentz symmetry, through mixture of a spin-1 block ands a spin-0 block with degnerate mass spectrum. Based on the two conditions, combined with the little group transformation and consistent factorization, we construct 3-point and 4-point vector boson/scalar amplitudes, then analyze the underlying physical models. Given the particle masses, almost all possible vertices, including those involving Goldstone modes, are uniquely fixed. The only exceptions are triple and quartic scalar self-couplings. In addition, all particle masses must have the same physical origin. If the number of vector bosons smaller than 3, the underlying theories for the amplitudes are either massive gauge theories with spontaneous symmetry breaking (S.S.B) or Stueckelberg theory. The necessary condition for the latter is that the scalars have equal masses. We also discuss different models depending on the number of scalars involved. If the number of vector bosons larger than 3, the underlying theory must be Yang-Mills theory with S.S.B. In both abelian and non-abelian cases, the specific shape of Higgs potential cannot be determined, which explains the fact that scalar self-couuplings are undetermined, and the relations between the masses are generally not linear.",2025,['Junmou Chen'],http://arxiv.org/abs/2510.09003v1,arxiv,,,,,,,2510.09003v1,,False
,,Relativistic Particle on Light-Front,"We study Wigner's classification of massive one particle state in a general moving frame in the front form of Lorentz group, characterized and labeled by a special null vector -- reference vector. The little group transformation turns out to be equivalent to a change of reference vector, which also gives a concrete formula to compute the Wigner D-matrices with a general momentum. The little group transformation and Wigner D-matrices have both continuous zero momentum limit and infinite boost (massless) limit, a property that can be called massive-massless continuation. We then apply those results to massive spin-1 particle and compute the corresponding Wigner D-matrices. The resulting polarization vectors are equivalent to those in spinor-helicity formalism. In the massless limit, it is shown that longitudinal polarization decouples from the spectrum. The $\epsilon^\mu_\pm \rightarrow \epsilon^\mu_\pm +\xi k^\mu$ shift turns out to be remnant of this decoupling, with $\xi$ computable from the Wigner D-matrix. Thus in our construction, massless spin-1 particle can be defined as the infinite boost limit of massive spin-1 particle. Our results also give us a deeper understanding of gauge symmetry: it can be understood as the equivalence between obtaining the massless limit for polarization vectors through different reference vectors.",2025,['Junmou Chen'],http://arxiv.org/abs/2510.08983v1,arxiv,,,,,,,2510.08983v1,,False
,,Burnup Measurement using Bent Crystal Spectrometer for Pebble Bed   Reactors,"Burnup measurement is essential for monitoring and controlling pebble bed reactors (PBRs), where fuel pebbles circulate rapidly through the core. However, conventional gamma spectroscopy using high purity germanium (HPGe) detectors is difficult due to high activity levels in discharge pebbles, leading to excessive dead time and Compton scattering. This study explores the use of bent crystal diffraction (BCD) spectrometers to filter the emitted gamma spectrum and isolate key peaks for improved measurement accuracy and speed. Pebble wise depletion calculations were performed and the resulting spectra were analyzed using ray tracing (SHADOW3) and gamma response modeling (GADRAS). Key isotopes, $^{137m}$Ba/$^{137}$Cs, $^{239}$Pu, $^{144}$Ce, $^{148m}$Pm, and $^{140}$La, were found to strongly correlate with burnup, residence time, core passes, plutonium production, and fluence. Machine learning regression models applied to simulated spectra achieved a coefficient of determination ($R^2$) as high as 0.995 for burnup prediction. Among various BCD configurations, mosaic silicon crystals in the (440) orientation combined with an HPGe detector provided optimal performance for $^{137m}$Ba, while (220) and (440) configurations paired with scintillators were effective for the remaining isotopes.",2025,"['Ian Kolaja', 'Lee Bernstein', 'Ludovic Jantzen', 'Eleanor Tubman', 'Tatiana Siaraferas', 'Massimiliano Fratoni']",http://arxiv.org/abs/2510.08835v1,arxiv,,,,,,,2510.08835v1,,True
,,"TIGER: A Topology-Agnostic, Hierarchical Graph Network for Event   Reconstruction","Event reconstruction at the LHC, the task of assigning observed physics objects to their true origins, is a central challenge for precision measurements and searches. Many existing machine learning approaches address this problem but rely on a single event topology, restricting their applicability to realistic analyses where multiple signal and background processes with different structures are present. To overcome this, we present TIGER, a novel hierarchical graph network that is fundamentally topology-agnostic. By incorporating only the common underlying structure of sequential two-body decays, our model can reconstruct complex events without process-specific assumptions. This flexible architecture supports multi-task learning, enabling simultaneous event reconstruction and classification. TIGER thus provides a powerful and generalizable tool for physics analysis at the LHC.",2025,"['Nathalie Soybelman', 'Francesco A. Di Bello', 'Nilotpal Kakati', 'Eilam Gross']",http://arxiv.org/abs/2510.08162v1,arxiv,,,,,,,2510.08162v1,,True
,,Locality-Sensitive Hashing-Based Efficient Point Transformer for Charged   Particle Reconstruction,"Charged particle track reconstruction is a foundational task in collider experiments and the main computational bottleneck in particle reconstruction. Graph neural networks (GNNs) have shown strong performance for this problem, but costly graph construction, irregular computations, and random memory access patterns substantially limit their throughput. The recently proposed Hashing-based Efficient Point Transformer (HEPT) offers a theoretically guaranteed near-linear complexity for large point cloud processing via locality-sensitive hashing (LSH) in attention computations; however, its evaluations have largely focused on embedding quality, and the object condensation pipeline on which HEPT relies requires a post-hoc clustering step (e.g., DBScan) that can dominate runtime. In this work, we make two contributions. First, we present a unified, fair evaluation of physics tracking performance for HEPT and a representative GNN-based pipeline under the same dataset and metrics. Second, we introduce HEPTv2 by extending HEPT with a lightweight decoder that eliminates the clustering stage and directly predicts track assignments. This modification preserves HEPT's regular, hardware-friendly computations while enabling ultra-fast end-to-end inference. On the TrackML dataset, optimized HEPTv2 achieves approximately 28 ms per event on an A100 while maintaining competitive tracking efficiency. These results position HEPTv2 as a practical, scalable alternative to GNN-based pipelines for fast tracking.",2025,"['Shitij Govil', 'Jack P. Rodgers', 'Yuan-Tang Chou', 'Siqi Miao', 'Amit Saha', 'Advaith Anand', 'Kilian Lieret', 'Gage DeZoort', 'Mia Liu', 'Javier Duarte', 'Pan Li', 'Shih-Chieh Hsu']",http://arxiv.org/abs/2510.07594v1,arxiv,,,,,,,2510.07594v1,,True
,,Neural Triangular Transport Maps: A New Approach Towards Sampling in   Lattice QCD,"Lattice field theories are fundamental testbeds for computational physics; yet, sampling their Boltzmann distributions remains challenging due to multimodality and long-range correlations. While normalizing flows offer a promising alternative, their application to large lattices is often constrained by prohibitive memory requirements and the challenge of maintaining sufficient model expressivity. We propose sparse triangular transport maps that explicitly exploit the conditional independence structure of the lattice graph under periodic boundary conditions using monotone rectified neural networks (MRNN). We introduce a comprehensive framework for triangular transport maps that navigates the fundamental trade-off between \emph{exact sparsity} (respecting marginal conditional independence in the target distribution) and \emph{approximate sparsity} (computational tractability without fill-ins). Restricting each triangular map component to a local past enables site-wise parallel evaluation and linear time complexity in lattice size $N$, while preserving the expressive, invertible structure. Using $\phi^4$ in two dimensions as a controlled setting, we analyze how node labelings (orderings) affect the sparsity and performance of triangular maps. We compare against Hybrid Monte Carlo (HMC) and established flow approaches (RealNVP).",2025,"['Andrey Bryutkin', 'Youssef Marzouk']",http://arxiv.org/abs/2510.13112v1,arxiv,,,,,,,2510.13112v1,,True
,,Classification and Birational Equivalence of Dimer Integrable Systems   for Reflexive Polygons,"Brane tilings are bipartite periodic graphs on the 2-torus and realize a large family of 4d N=1 supersymmetric gauge theories corresponding to toric Calabi-Yau 3-folds. We present a complete classification of dimer integrable systems corresponding to the 30 brane tilings whose toric Calabi-Yau 3-folds are given by the 16 reflexive polygons in 2 dimensions. For each dimer integrable system associated to a reflexive polygon, we present the Casimirs, the single Hamiltonian built from 1-loops, the spectral curve, and the Poisson commutation relations. We also identify all birational equivalences between dimer integrable systems in this classification by presenting the birational transformations that match the Casimirs and the Hamiltonians as well as the spectral curves and Poisson structures between equivalent dimer integrable systems. In total, we identify 16 pairs of birationally equivalent dimer integrable systems which combined with Seiberg duality between the corresponding brane tilings form 5 distinct equivalence classes. Echoing phenomena observed for brane brick models realizing a family of 2d (0,2) supersymmetric gauge theories corresponding to toric Calabi-Yau 4-folds, we illustrate that deformations of brane tilings, including mass deformations, correspond to the birational transformations we discover in this work, and leave invariant the number of generators of the mesonic moduli space as well as the corresponding U(1)R-refined Hilbert series.",2025,"['Minsung Kho', 'Norton Lee', 'Rak-Kyeong Seong']",http://arxiv.org/abs/2510.12290v1,arxiv,,,,,,,2510.12290v1,,False
,,Applying Normalizing Flows for spin correlations reconstruction in   associated top-quark pair and dark matter production,"We apply a unified machine-learning framework based on Normalizing Flows (NFs) for the event-by-event reconstruction of invisible momenta and the subsequent evaluation of spin-sensitive observables in top-quark pair and dark-matter (DM) associated production processes. Building on recent studies in single-top + DM topologies, we extend the research to $t\bar{t}$ + DM final states. Inputs to our networks combine low-level four-momenta and missing transverse energy with high-level kinematic and angular variables. We compare a baseline multilayer perceptron (MLP) regressor, an autoregressive flow, and the conditional $\nu$-Flows model -- trained to learn the full conditional density. In these final states all the models perform well and demonstrate high reconstruction quality in independent regions split by $m_{t\bar{t}}$ for validation purposes. We highlight the potential of this approach to be extended to three- and four-top-quark production.",2025,"['E. Abasov', 'L. Dudko', 'E. Iudin', 'A. Markina', 'P. Volkov', 'G. Vorotnikov', 'M. Perfilov', 'A. Zaborenko']",http://arxiv.org/abs/2510.11644v1,arxiv,,,,,,,2510.11644v1,,False
,,Optimised neural networks for online processing of ATLAS calorimeter   data on FPGAs,"A study of neural network architectures for the reconstruction of the energy deposited in the cells of the ATLAS liquid-argon calorimeters under high pile-up conditions expected at the HL-LHC is presented. These networks are designed to run on the FPGA-based readout hardware of the calorimeters under strict size and latency constraints. Several architectures, including Dense, Recurrent (RNN), and Convolutional (CNN) neural networks, are optimised using a Bayesian procedure that balances energy resolution against network size. The optimised Dense, CNN, and combined Dense+RNN architectures achieve a transverse energy resolution of approximately 80 MeV, outperforming both the optimal filtering (OF) method currently in use and RNNs of similar complexity. A detailed comparison across the full dynamic range shows that Dense, CNN, and Dense+RNN accurately reproduce the energy scale, while OF and RNNs underestimate the energy. Deep Evidential Regression is implemented within the Dense architecture to address the need for reliable per-event energy uncertainties. This approach provides predictive uncertainty estimates with minimal increase in network size. The predicted uncertainty is found to be consistent, on average, with the difference between the true deposited energy and the predicted energy.",2025,"['Georges Aad', 'Raphael Bertrand', 'Lauri Laatu', 'Emmanuel Monnier', 'Arno Straessner', 'Nairit Sur', 'Johann C. Voigt']",http://arxiv.org/abs/2510.11469v1,arxiv,,,,,,,2510.11469v1,,True
,,Improved Pixel-wise Calibration for Charge-Integrating Hybrid Pixel   Detectors with Performance Validation,"The M\""ONCH hybrid pixel detector, with a 25 \textmu m pixel pitch and fast charge-integrating readout, has demonstrated subpixel resolution capabilities for X-ray imaging and deep learning-based electron localization in electron microscopy. Fully exploiting this potential requires extensive calibration to ensure both linearity and uniformity of the pixel response, which is challenging for detectors with a large dynamic range. To overcome the limitations of conventional calibration methods, we developed an accurate and efficient correction method to achieve pixel-wise gain and nonlinearity calibration based on the backside pulsing technique. A three-dimensional lookup table was generated for all pixels across the full dynamic range, mapping the pixel response to a calibrated linear energy scale. Compared with conventional linear calibration, the proposed method yields negligible deviations between the calibrated and nominal energies for photons and electrons. The improvement in energy resolution ranges from 4% to 22% for 15-25 keV photons and from 16% to 23% for 60-200 keV electrons. Deep learning-based electron localization demonstrates a 4% improvement in spatial resolution when using the proposed calibration method. This approach further enables rapid diagnosis of the cause of bad pixels and estimation of bump-bonding yield.",2025,"['X. Xie', 'A. Bergamaschi', 'M. Brückner', 'M. Carulla', 'R. Dinapoli', 'S. Ebner', 'K. Ferjaoui', 'E. Fröjdh', 'V. Gautam', 'D. Greiffenberg', 'S. Hasanaj', 'J. Heymes', 'V. Hinger', 'M. Hürst', 'V. Kedych', 'T. King', 'S. Li', 'C. Lopez-Cuenca', 'A. Mazzoleni', 'D. Mezza', 'K. Moustakas', 'A. Mozzanica', 'J. Mulvey', 'M. Müller', 'K. A. Paton', 'C. Posada Soto', 'C. Ruder', 'B. Schmitt', 'P. Sieber', 'S. Silletta', 'D. Thattil', 'J. Zhang']",http://arxiv.org/abs/2510.11024v1,arxiv,,,,,,,2510.11024v1,,True
,,Topological Landscapes of the BSM Higgs Sector,"We explore the structure of the parameter space in the Singlet Scalar Dark Matter (SSDM) model and the Next-to-Two Higgs Doublet Model (N2HDM) with $\tan\beta = 5$ and $\tan\beta = 45$. Parameter points are classified as allowed or excluded based on compatibility with the Higgs observation constraints. Using a combined framework of Topological Data Analysis (TDA), Uniform Manifold Approximation and Projection (UMAP), and Linear Discriminant Analysis (LDA), we characterize the global geometry and topology of these high-dimensional landscapes. Our findings reveal that the SSDM and the N2HDM Type~I model exhibit finely tuned islands of collider viability. In the case of N2HDM Type~I, we also find that increasing $\tan\beta$ leads to greater topological fragmentation and higher Betti number persistence, indicating enhanced structural complexity. In contrast, the given choice of parameters excludes the entire N2HDM Type II parameter space based on current Higgs measurements. The topological properties serve as important quantitative descriptors for the phenomenological viability of the BSM frameworks. We leverage the above mentioned topological features to train machine learning models for faster characterization of the BSM Higgs sector into allowed and excluded parameter regions.",2025,['Jyotiranjan Beuria'],http://arxiv.org/abs/2510.10900v1,arxiv,,,,,,,2510.10900v1,,True
