paper_key,key_type,title,abstract,year,authors,url,source,depth,clean_abstract,Topic_r1,Topic_r2,Topic_r3,Topic_final,arxiv_id,doi,is_ml
,,Renormalization of Interacting Random Graph Models,"Random graphs offer a useful mathematical representation of a variety of real world complex networks. Exponential random graphs, for example, are particularly suited towards generating random graphs constrained to have specified statistical moments. In this investigation, we elaborate on a generalization of the former where link probabilities are conditioned on the appearance of other links, corresponding to the introduction of interactions in an effective generalized statistical mechanical formalism. When restricted to the simplest non-trivial case of pairwise interactions, one can derive a closed form renormalization group transformation for maximum coordination number two on the corresponding line graph. Higher coordination numbers do not admit exact closed form renormalization group transformations, a feature that paraphrases the usual absence of exact transformations in two or more dimensional lattice systems. We introduce disorder and study the induced renormalization group flow on its probability assignments, highlighting its formal equivalence to time reversed anisotropic drift-diffusion on the statistical manifold associated with the effective Hamiltonian. We discuss the implications of our findings, stressing the long wavelength irrelevance of certain classes of pair-wise conditioning on random graphs, and conclude with possible applications. These include modeling the scaling behavior of preferential effects on social networks, opinion dynamics, and reinforcement effects on neural networks, as well as how our findings offer a systematic framework to deal with data limitations in inference and reconstruction problems.",2025,"['Alessio Catanzaro', 'Diego Garlaschelli', 'Subodh P. Patil']",http://arxiv.org/abs/2510.07186v1,arxiv,,,,,,,2510.07186v1,,True
,,Localized states of BFSS super quantum mechanics,"We analyze the recently discovered localized and non-uniform phases of the Banks-Fischler-Shenker-Susskind (BFSS) matrix quantum mechanics. Building on [1], we provide first-principles derivations of their properties and extend the results with new analytic and numerical insights. We show that strongly coupled BFSS dynamics emerge from a specific Carrollian transformation of 11-dimensional supergravity, which we justify in detail. In this framework, the uniform BFSS phase corresponds to a black string in a $pp$-wave background. We demonstrate that this background is unstable to a Gregory-Laflamme instability and, for the first time, compute the associated growth rate. The instability gives rise to non-uniform and localized phases that dominate the microcanonical ensemble in certain low-energy regimes, with the localized phase also prevailing in the canonical ensemble at low temperatures. We identify the corresponding first- and second-order phase transitions and derive analytic formulas for the thermodynamics of the localized phase, accurate to better than $0.3\%$ against numerical results.",2025,"['Oscar J. C. Dias', 'Jorge E. Santos']",http://arxiv.org/abs/2510.07379v1,arxiv,,,,,,,2510.07379v1,,False
,,Spinning Mellin amplitudes,"We propose a definition of Mellin amplitudes for conformal correlators involving arbitrary spinning operators in tensor representations of the Lorentz group. These representations cover all bosonic local operators. Our strategy is to perform discrete Mellin transforms on all scalar products involving polarization vectors, so that each polarization vector can be interpreted as the position of a fictitious scalar operator. We establish the general pole structures and factorization properties of these spinning Mellin amplitudes. We also provide a systematic algorithm to derive factorization formulas with arbitrary spinning exchanges, yielding new explicit results up to spin-4. To illustrate the practicality of our formalism, we bootstrap the 3- and 4-point current correlators in a 4d $\mathcal{N}=2$ superconformal field theory, which are dual to gluon scattering amplitudes in $\mathrm{AdS}_5 \times \mathrm{S}^3$. The results agree with the snowflake channel of 6- and 8-point scalar supergluon amplitudes in the literature.",2025,"['Zhongjie Huang', 'Yichao Tang']",http://arxiv.org/abs/2510.07388v1,arxiv,,,,,,,2510.07388v1,,False
,,On the consistent disformal couplings to fermions,"Disformal couplings to fermions lead to a unique derivative coupling to the axial fermionic current, which contains higher derivatives in general. We derive general conditions on consistent disformal couplings by requiring the absence of higher time derivatives, as they typically lead to ghost degrees of freedom. For a two-scalar field disformal transformation, we show that the consistent disformal coupling must have a degenerate field space metric. This allows us to explore consistent, new two-scalar field modified gravity models. We show that the transformation of the Einstein-Hilbert action leads to two-field Horndeski or two-field DHOST theories. Our formalism also applies to disformal transformations with higher derivatives. We derive the consistent subclasses of disformal transformations that include second derivatives of a scalar field and first derivatives of a vector field that lead to generalized U-DHOST and degenerate beyond generalized Proca theories.",2025,"['Guillem Domènech', 'Alexander Ganz', 'Apostolos Tsabodimos']",http://arxiv.org/abs/2510.07419v1,arxiv,,,,,,,2510.07419v1,,False
,,Boosted decision tree reweighting of simulated neutrino interactions for   $O(1)$ GeV neutrino cross-section measurements,"This paper illustrates a generic method for multi-dimensional reweighting of $O(1)$ GeV neutrino interaction Monte Carlo samples. The reweighting is based on a Boosted Decision Tree algorithm trained on high-dimensional space in detector final state observables. This enables one generator's events to be reweighted so that its reconstructed particle content and kinematics distributions, as well as detector efficiency, match those of a target model. The approach establishes an efficient way to reuse legacy Monte Carlo data, avoiding re-generation. As an example, we test its use in a measurement of transverse kinematic imbalance of the $\mu^-$ and proton in charged-current quasielastic like $\nu_\mu$ events from the MINERvA experiment.",2025,"['Z. Lin', 'S. Akhter', 'Z. Ahmad Dar', 'N. S. Alex', 'M. Betancourt', 'S. Boyd', 'H. Budd', 'G. Caceres', 'G. A. Díaz', 'J. Felix', 'L. Fields', 'A. M. Gago', 'P. K. Gaur', 'S. M. Gilligan', 'R. Gran', 'D. A. Harris', 'A. L. Hart', 'J. Kleykamp', 'A. Klustová', 'D. Last', 'A. Lozano', 'X. -G. Lu', 'S. Manly', 'W. A. Mann', 'K. S. McFarland', 'O. Moreno', 'J. K. Nelson', 'V. Paolone', 'G. N. Perdue', 'C. Pernas', 'M. A. Ramírez', 'N. Roy', 'D. Ruterbories', 'H. Schellman', 'C. J. Solano Salinas', 'D. S. Correia', 'M. Sultana', 'N. H. Vaughan', 'A. V. Waldron', 'B. Yaeggy', 'L. Zazueta']",http://arxiv.org/abs/2510.07463v1,arxiv,,,,,,,2510.07463v1,,True
,,Apparent Lorentz violation from disformally coupled ultralight dark   matter,"We study the impact of general disformal metric transformations on fermions, which shift the gravitational metric by an additional rank-2 tensor. This tensor can in principle be constructed from scalar-field gradients, vector fields, or field-strength contractions. We show this transformation results in the conventional Dirac action being modified by additional kinetic and axial-current couplings that are quadratic in the shifted field. When the field sourcing the metric shift takes on a non-trivial background value, apparent Lorentz-violating effects can result, which we identify as terms in an effective field theory. Assuming the well-motivated cases of scalar and vector ultralight dark matter, we demonstrate that experimental tests of rotation and boost violation imply constraints on the additional kinetic coupling. Even under conservative assumptions, the constraints for vector ultralight dark matter are extremely stringent.",2025,"['Guillem Domènech', 'Apostolos Tsabodimos', 'Nathaniel Sherrill', 'Alexander Ganz', 'Fiona Kirk']",http://arxiv.org/abs/2510.07490v1,arxiv,,,,,,,2510.07490v1,,False
,,Efficient Radiofrequency Sensing with Fluorescence Encoding,"Optically-active spin qubits have emerged as powerful quantum sensors capable of nanoscale magnetometry, yet conventional coherent sensing approaches are ultimately limited by the coherence time of the sensor, typically precluding detection in the sub-MHz regime. We present a broadly applicable fluorescence-encoding method that circumvents coherence-time constraints by transducing time-varying magnetic fields directly into modulated fluorescence signals. Using nitrogen-vacancy centers in diamond as a model system, we demonstrate shot-noise-limited sensitivity for AC magnetic fields spanning near-DC to MHz frequencies, with detection bandwidth tunable via optical excitation power. The technique captures complete spectral information in a single measurement, eliminating the need for point-by-point frequency scanning, and allows phase-sensitive multi-frequency detection with Hz-level resolution. This approach transforms quantum sensors into atomic-scale spectrum analyzers, with immediate applications for low-frequency RF communication, zero-field NMR, and bioelectronic sensing. Our approach is broadly applicable to the expanding class of optically-active spin qubits, including molecular systems and fluorescent proteins, opening new sensing regimes previously inaccessible to coherent techniques",2025,"['Nicole Voce', 'Paul Stevenson']",http://arxiv.org/abs/2510.07510v1,arxiv,,,,,,,2510.07510v1,,False
,,Enhancing the Sensitivity for Triple Higgs Boson Searches with Deep   Learning Techniques,"Using two benchmark models containing extended scalar sectors beyond the Standard Model, we study deep learning techniques to enhance the sensitivity of resonant triple Higgs boson searches in the fully hadronic $6b$ channel, which suffers from the combinatorial challenge of reconstructing the Higgs bosons correctly from the multiple $b$-jets. More specifically, we employ the framework of Symmetry Preserving Attention Network (\textsc{Spa-Net}), which takes into account the permutational symmetry when a correct pairing of $b$-jets is achieved, to tackle both jet pairing and event classification. Significantly improved efficiency is achieved in signal and background discrimination. When comparing with the conventional Dense Neural Networks, \textsc{Spa-Net} results in up to 40\% more stringent limits on resonant production cross-sections. These results highlight the potential of using advanced machine learning techniques to significantly improve the sensitivity of triple Higgs boson searches in the fully hadronic channel.",2025,"['Cheng-Wei Chiang', 'Feng-Yang Hsieh', 'Shih-Chieh Hsu', 'Ian Low', 'Zhi-Zhong Li']",http://arxiv.org/abs/2510.01672v1,arxiv,,,,,,,2510.01672v1,,True
,,Charged Black-Hole Binary Evolution at Second Post-Newtonian Order,"We study the dynamics of electrically charged black-hole binaries and their gravitational-wave emission during the inspiral phase. Within the post-Newtonian framework, we derive the conservative and dissipative dynamics up to second order (2PN), combining Effective Field Theory and classical methods. We compute the NNLO conservative Lagrangian, LO dissipative effects in harmonic and Lorenz gauges, and provide the equations of motion, center-of-mass transformations, and the Lagrangian/Hamiltonian in ADM-type coordinates. We also obtain gauge-invariant expressions for the binding energy, periastron advance in quasi-circular orbits, and the scattering angle in unbound orbits. Our results extend previous analyses and are fully consistent with recent post-Minkowskian findings.",2025,"['Andrea Placidi', 'Elisa Grilli', 'Marta Orselli', 'Matteo Pegorin', 'Nicola Bartolo', 'Pierpaolo Mastrolia']",http://arxiv.org/abs/2509.20432v2,arxiv,,,,,,,2509.20432v2,,False
,,Spinning Boundary Correlators from (A)dS$_4$ Twistors,"We develop a twistor-space framework to compute boundary correlators via a boundary limit of nested Penrose transforms in (A)dS$_4$. Starting from correlators of (anti-)self-dual bulk fields, the boundary limit reproduces the correlators of the dual conserved currents; we demonstrate this explicitly for two- and three-point functions. The two-point correlator is rendered finite by working in Euclidean signature. At three points, we obtain compact rational twistor-space representatives obeying a double-copy relation, thereby clarifying the twistor-space origin of the results in Baumann et al. 2024. We further extend the analysis to non-conserved currents with integer conformal dimension, dual to massive bulk fields, as well as to the free scalar.",2025,"['Mariana Carrillo González', 'Théo Keseman']",http://arxiv.org/abs/2510.00096v1,arxiv,,,,,,,2510.00096v1,,False
,,"Complex Lies, Real Physics: The Role of Algebra Complexification","In physics, Lie groups represent the algebraic structure that describes symmetry transformations of a given system. Then, the descending Lie algebra of those groups are necessary real. In most cases, the complexification of those Lie algebra is necessary in order to derive irreductible representations of the Lie algebra and subsequently of the symmetry group. In this paper, we give a precise definition of the concept and prove step by step an important result $$\left(\mathfrak{g}^\mathbb{R}\right)_\mathbb{C} \simeq \mathfrak{g} \times \bar{\mathfrak{g}}. $$ This result is used to determine the irreductible representations of the proper Lorentz group and thus the physical objects admissible when this symmetry is present. It is shown that finite representations of the proper Lorentz group are characterized by pairs of half-integers $(j_1,j_2)$, which determine unambiguously the physical object associated to the given representation. For example, the representation $(0,0)$ of dimension $1$ is called the scalar representation, it corresponds to the Higgs field, and $(\frac{1}{2},0) \oplus (0,\frac{1}{2})$ of dimension $4$ is called the Dirac spinor representation, it corresponds to matter particle called fermions. This means that the mathematical group structure determines the material content of the universe following this algebraic structure.",2025,"['Tanguy Marsault', 'Laurent Schoeffel']",http://arxiv.org/abs/2509.20929v2,arxiv,,,,,,,2509.20929v2,,False
,,Advancing the CMS Level-1 Trigger: Jet Tagging with DeepSets at the   HL-LHC,"At the High Luminosity LHC, selecting important physics processes such as (di-) Higgs production will be a high priority. The Phase-2 Upgrade of the CMS Level-1 Trigger will reconstruct particle candidates and use pileup mitigation for the 200 simultaneous proton-proton interactions. A fast cone algorithm will reconstruct jets from these particles, providing access to jet constituents for the first time. We introduce a new multi-class jet tagger with a small, quantized DeepSets neural network. The tagger, trained on a mix of simulated CMS events, predicts various hadronic and leptonic classes. We present the tagger, its performance, and its improvements for triggering on (di-) Higgs events.",2025,"['Stella Schaefer', 'Christopher Brown', 'Duc Hoang', 'Sioni Summers', 'Sebastian Wuchterl']",http://arxiv.org/abs/2509.24371v1,arxiv,,,,,,,2509.24371v1,,True
,,Overlap-aware segmentation for topological reconstruction of obscured   objects,"The separation of overlapping objects presents a significant challenge in scientific imaging. While deep learning segmentation-regression algorithms can predict pixel-wise intensities, they typically treat all regions equally rather than prioritizing overlap regions where attribution is most ambiguous. Recent advances in instance segmentation show that weighting regions of pixel overlap in training can improve segmentation boundary predictions in regions of overlap, but this idea has not yet been extended to segmentation regression. We address this with Overlap-Aware Segmentation of ImageS (OASIS): a new segmentation-regression framework with a weighted loss function designed to prioritize regions of object-overlap during training, enabling extraction of pixel intensities and topological features from heavily obscured objects. We demonstrate OASIS in the context of the MIGDAL experiment, which aims to directly image the Migdal effect--a rare process where electron emission is induced by nuclear scattering--in a low-pressure optical time projection chamber. This setting poses an extreme test case, as the target for reconstruction is a faint electron recoil track which is often heavily-buried within the orders-of-magnitude brighter nuclear recoil track. Compared to unweighted training, OASIS improves median intensity reconstruction errors from -32% to -14% for low-energy electron tracks (4-5 keV) and improves topological intersection-over-union scores from 0.828 to 0.855. These performance gains demonstrate OASIS's ability to recover obscured signals in overlap-dominated regions. The framework provides a generalizable methodology for scientific imaging where pixels represent physical quantities and overlap obscures features of interest. All code is openly available to facilitate cross-domain adoption.",2025,"['J. Schueler', 'H. M. Araújo', 'S. N. Balashov', 'J. E. Borg', 'C. Brew', 'F. M. Brunbauer', 'C. Cazzaniga', 'A. Cottle', 'D. Edgeman', 'C. D. Frost', 'F. Garcia', 'D. Hunt', 'M. Kastriotou', 'P. Knights', 'H. Kraus', 'A. Lindote', 'M. Lisowska', 'D. Loomba', 'E. Lopez Asamar', 'P. A. Majewski', 'T. Marley', 'C. McCabe', 'L. Millins', 'R. Nandakumar', 'T. Neep', 'F. Neves', 'K. Nikolopoulos', 'E. Oliveri', 'A. Roy', 'T. J. Sumner', 'E. Tilly', 'W. Thompson', 'M. A. Vogiatzi']",http://arxiv.org/abs/2510.06194v1,arxiv,,,,,,,2510.06194v1,,True
,,TrackCore-F: Deploying Transformer-Based Subatomic Particle Tracking on   FPGAs,"The Transformer Machine Learning (ML) architecture has been gaining considerable momentum in recent years. In particular, computational High-Energy Physics tasks such as jet tagging and particle track reconstruction (tracking), have either achieved proper solutions, or reached considerable milestones using Transformers. On the other hand, the use of specialised hardware accelerators, especially FPGAs, is an effective method to achieve online, or pseudo-online latencies. The development and integration of Transformer-based ML to FPGAs is still ongoing and the support from current tools is very limited to non-existent. Additionally, FPGA resources present a significant constraint. Considering the model size alone, while smaller models can be deployed directly, larger models are to be partitioned in a meaningful and ideally, automated way. We aim to develop methodologies and tools for monolithic, or partitioned Transformer synthesis, specifically targeting inference. Our primary use-case involves two machine learning model designs for tracking, derived from the TrackFormers project. We elaborate our development approach, present preliminary results, and provide comparisons.",2025,"['Arjan Blankestijn', 'Uraz Odyurt', 'Amirreza Yousefzadeh']",http://arxiv.org/abs/2509.26335v1,arxiv,,,,,,,2509.26335v1,,True
,,Time-dependent 3D oscillator with Coulomb interaction: an alternative   approach for analyzing quark-antiquark systems,"In this work, the dynamics of quark-antiquark pair systems is investigated by modelling them as general time-dependent 3D oscillators perturbed by a Coulomb potential. Solving this model enables the prediction of key mesonic properties such as the probability density, energy spectra, and quadrature uncertainties, offering theoretical insights into the confinement of quarks via gluon-mediated strong interactions. To tackle the mathematical difficulty raised by the time dependence of parameters in the system, special mathematical techniques, such as the invariant operator method, unitary transformation method, and the Nikiforov-Uvarov functional analysis (NUFA) are used. The wave functions of the system, derived using these mathematical techniques, are expressed analytically in terms of the Gauss hypergeometric function whose mathematical properties are well characterized. Our results provide the quantum mechanical framework of quark-antiquark systems which are essential for exploring the non-perturbative aspects of QCD. In addition, the underlying mathematical structure may serve as a foundation for addressing broader challenges in particle physics, including the origin of mass and its connection to the Higgs mechanism.",2025,"['Jeong Ryeol Choi', 'Salim Medjber', 'Salah Menouar', 'Ramazan Sever']",http://arxiv.org/abs/2510.04541v1,arxiv,,,,,,,2510.04541v1,,False
,,Subleading Twist-3 Gluon Generalized Parton Distributions in the   Light-Front Model,"We present a calculation of the twist-3 generalized parton distributions (GPDs) for gluons in the proton. Our analysis is performed within a light-front constituent model where the proton is treated as a two-body state of a spin-1 gluon and a spin-1/2 spectator system. The requisite light-front wave functions are derived from the soft-wall AdS/QCD correspondence. We compute the complete set of twist-3 gluon GPDs over a broad kinematic range. The corresponding distributions in impact parameter space are obtained via Fourier transform, revealing the transverse spatial distribution of gluons. Furthermore, we evaluate the contribution of these GPDs to the gluon kinetic orbital angular momentum (OAM) and compare our findings with other theoretical predictions.",2025,"['Parashmani Thakuria', 'Madhurjya Lalung', 'Jayanta Kumar Sarma']",http://arxiv.org/abs/2510.04513v1,arxiv,,,,,,,2510.04513v1,,False
,,Approximate Gaussianity Beyond Initialisation in Neural Networks,"Ensembles of neural network weight matrices are studied through the training process for the MNIST classification problem, testing the efficacy of matrix models for representing their distributions, under assumptions of Gaussianity and permutation-symmetry. The general 13-parameter permutation invariant Gaussian matrix models are found to be effective models for the correlated Gaussianity in the weight matrices, beyond the range of applicability of the simple Gaussian with independent identically distributed matrix variables, and notably well beyond the initialisation step. The representation theoretic model parameters, and the graph-theoretic characterisation of the permutation invariant matrix observables give an interpretable framework for the best-fit model and for small departures from Gaussianity. Additionally, the Wasserstein distance is calculated for this class of models and used to quantify the movement of the distributions over training. Throughout the work, the effects of varied initialisation regimes, regularisation, layer depth, and layer width are tested for this formalism, identifying limits where particular departures from Gaussianity are enhanced and how more general, yet still highly-interpretable, models can be developed.",2025,"['Edward Hirst', 'Sanjaye Ramgoolam']",http://arxiv.org/abs/2510.05218v1,arxiv,,,,,,,2510.05218v1,,True
,,Baryons as linked vortices in QCD matter with isospin asymmetry,"We investigate a baryonic structure in low-energy QCD via a model-independent way using the chiral perturbation theory at the leading order, in the presence of the baryon chemical potential $\mu_B$, the isospin chemical potential $\mu_I$, and the electromagnetic coupling. For such a scenario in the chiral limit, it has been known that the neutral pion winds like in the chiral soliton lattice, confined within an Abrikosov-Nielsen-Olesen (ANO) vortex of the charged pions. This structure undergoes a drastic transformation when the pion mass is introduced, i.e., both charged and neutral pions condense in the bulk, allowing two distinct types of vortices: the charged pions constitute a local ANO-like vortex, while the neutral pion configures a global vortex which is further attached to a domain wall also known as the chiral soliton. Remarkably, the ANO vortex forms a topological linking with the closed global vortex line, when $\mu_B$ exceeds its critical value as a function of $\mu_I$. The linking number has the physical meaning of the baryon number in view of the Wess-Zumino-Witten term. In this sense, the linked configuration realizes a stable Skyrmion-type solution, but innovatively without the Skyrme term. We therefore propose a novel phase of dense baryonic matter comprised of such vortices, which shall play a role in the low-energy QCD phase diagram.",2025,"['Yu Hamada', 'Muneto Nitta', 'Zebin Qiu']",http://arxiv.org/abs/2509.20844v1,arxiv,,,,,,,2509.20844v1,,False
