paper_key,key_type,title,abstract,year,authors,url,source,depth,clean_abstract,Topic_r1,Topic_r2,Topic_r3,Topic_final,arxiv_id,doi,is_ml
,,A family of three maximally symmetric boost-invariant flows in   relativistic hydrodynamics,"I discuss the constructions of boost-invariant dissipative conformal hydrodynamic flows by elaborating on the geometric procedure by Gubser and Yarom, which starts from a static, maximally symmetric flow on dS$_3\times\mathbb{R}$. Three foliations of dS$_3$ preserve three-dimensional non-Abelian isometry groups, namely, the flat ISO(2)-invariant, the spherical (closed) SO(3)-invariant, and the hyperbolic (open) SO(2,1)-invariant slicings. I show that the fluids that preserve these symmetries, after they have been Weyl transformed to flat spacetime, give rise to three physically distinct and boost-invariant solutions of the relativistic dissipative Navier-Stokes equations: the well-known and widely studied Bjorken and Gubser flows, and a seemingly thus far unexplored solution that arises from the hyperbolic slicing of dS$_3$. The new solution combines the radial expansion characteristic of the Gubser flow with the late-proper-time applicability of Bjorken's solution, and features a finite, radially bounded droplet whose expanding edge resembles a free-streaming shockwave.",2025,['Sašo Grozdanov'],http://arxiv.org/abs/2510.10769v1,arxiv,,,,,,,2510.10769v1,,False
,,Enhancing Phase Transition Calculations with Fitting and Neural Network,"The computation of bounce action in a phase transition involves solving partial differential equations, inherently introducing non-negligible numerical uncertainty. Deriving characteristic temperatures and properties of this transition necessitates both differentiation and integration of the action, thereby exacerbating the uncertainty. In this work, we fit the action curve as a function of temperature to mitigate the uncertainties inherent in the calculation of the phase transition parameters. We find that, after extracting a factor, the sixth-order polynomial yields an excellent fit for the action in the high temperature approximated potential. In a realistic model, the singlet extension of the Standard Model, this method performs satisfactorily across most of the parameter space after trimming the fitting data. This approach not only enhances the accuracy of phase transition calculations but also systematically reduces computation time and facilitates error estimation, particularly in models involving multiple scalar fields. Furthermore, we discussed the possible of using multiple neural networks to predict the action curve from model parameters.",2025,"['Ligong Bian', 'Hongxin Wang', 'Yang Xiao', 'Ji-Chong Yang', 'Jin Min Yang', 'Yang Zhang']",http://arxiv.org/abs/2510.10667v1,arxiv,,,,,,,2510.10667v1,,True
,,dN/dx Reconstruction with Deep Learning for High-Granularity TPCs,"Particle identification (PID) is essential for future particle physics experiments such as the Circular Electron-Positron Collider and the Future Circular Collider. A high-granularity Time Projection Chamber (TPC) not only provides precise tracking but also enables dN/dx measurements for PID. The dN/dx method estimates the number of primary ionization electrons, offering significant improvements in PID performance. However, accurate reconstruction remains a major challenge for this approach. In this paper, we introduce a deep learning model, the Graph Point Transformer (GraphPT), for dN/dx reconstruction. In our approach, TPC data are represented as point clouds. The network backbone adopts a U-Net architecture built upon graph neural networks, incorporating an attention mechanism for node aggregation specifically optimized for point cloud processing. The proposed GraphPT model surpasses the traditional truncated mean method in PID performance. In particular, the $K/\pi$ separation power improves by approximately 10% to 20% in the momentum interval from 5 to 20 GeV/c.",2025,"['Guang Zhao', 'Yue Chang', 'Jinxian Zhang', 'Linghui Wu', 'Huirong Qi', 'Xin She', 'Mingyi Dong', 'Shengsen Sun', 'Jianchun Wang', 'Yifang Wang', 'Chunxu Yu']",http://arxiv.org/abs/2510.10628v2,arxiv,,,,,,,2510.10628v2,,True
,,Integrability in Three-Dimensional Gravity: Eigenfunction-Forced KdV   Flows,"We uncover a direct connection between three-dimensional gravity with chiral boundary conditions and a class of forced integrable systems. Starting from the Chern-Simons formulation, we derive consistent boundary conditions on a non-compact spatial slice, leading to boundary dynamics described by the potential modified KdV hierarchy. The dynamics reduce to a forced KdV equation, where the forcing term is determined self-consistently by the eigenfunctions of the associated Schr\""{o}dinger operator. Using the inverse scattering transform, the reflectionless sector is solved via the Gelfand-Levitan-Marchenko method, while the radiative sector exhibits universal dispersive decay. This framework unifies AdS$_3$ boundary dynamics with integrable hierarchies and elucidates the roles of solitons and radiation in the dual conformal field theory.",2025,"['Hamed Adami', 'Anousheh Latifi']",http://arxiv.org/abs/2510.10519v1,arxiv,,,,,,,2510.10519v1,,False
,,Quantum Integration Networks for Efficient Monte Carlo in High-Energy   Physics,"Monte Carlo methods play a central role in particle physics, where they are indispensable for simulating scattering processes, modeling detector responses, and performing multi-dimensional integrals. However, traditional Monte Carlo methods often suffer from slow convergence and insufficient precision, particularly for functions with singular features such as rapidly varying regions or narrow peaks. Quantum circuits provide a promising alternative: compared to conventional neural networks, they can achieve rich expressivity with fewer parameters, and the parameter-shift rule provides an exact analytic form for circuit gradients, ensuring precise optimization. Motivated by these advantages, we investigate how sampling strategies and loss functions affect integration efficiency within the \textbf{Quantum Integration Network} (QuInt-Net). We compare adaptive and non-adaptive sampling approaches and examine the impact of different loss functions on accuracy and convergence. Furthermore, we explore three quantum circuit architectures for numerical integration: the data re-uploading model, the quantum signal processing protocol, and deterministic quantum computation with one qubit. The results provide new insights into optimizing QuInt-Nets for applications in high energy physics.",2025,"['Heechan Yi', 'Kayoung Ban', 'Myeonghun Park', 'Kyoungchul Kong']",http://arxiv.org/abs/2510.10501v1,arxiv,,,,,,,2510.10501v1,,True
,,New Evidence for Extragalactic Einstein Probe Transients associated with   Long Gamma-ray Bursts,"The origin of extragalactic fast X-ray transients (EFXTs) remains a fundamental open question in high-energy astrophysics. The Einstein Probe (EP) mission provides a transformative opportunity to investigate their nature. While mounting observations of EP-discovered EFXTs (EP-EFXTs) suggest a possible connection to long gamma-ray bursts (lGRBs), an in-depth comparative analysis between them remains lacking. Here, we present a comparative analysis of their cosmic formation histories, revealing that EP-EFXTs and lGRBs share a similar evolutionary trend-showing a marked decline at $z<1.0$ and a plateau beyond $1.0<z<5$-which clearly distinguishes them from short GRBs. This result is derived from a rigorously selected sample of EP-EFXTs, using Lynden-Bell's $c^{-}$ method to reconstruct, for the first time, the luminosity function and formation rate of EP-EFXTs without any assumptions. Our findings provide independent evidence that EP-EFXTs and lGRBs may originate from a common progenitor channel.",2025,"['Qin-Mei Li', 'Qi-Bin Sun', 'Sheng-Bang Qian', 'Fu-Xing Li']",http://arxiv.org/abs/2510.10267v1,arxiv,,,,,,,2510.10267v1,,False
,,Scaling properties of nuclear parton distributions in   short-range-correlation motivated two-component parametrization,"We provide some critical remarks on the recently proposed two-component parametrization of nuclear parton distribution functions, which was motivated by the apparent correlation between the nuclear modifications of structure functions and nucleon-nucleon short-range correlation phenomena. This parametrization, we show, is invariant under a rescaling transformation of the involved abundance coefficients, which means that the global normalization of these coefficients cannot be meaningfully determined in a fit, and only their ratios should be studied for finding evidence of short-range-correlation type behavior at parton level. As we show, however, the current constraints for the nuclear-mass dependence of these coefficients allow also for interpretations different from short-range correlations. Nevertheless, this two-component parametrization exhibits a similar scaling relation for DIS structure functions as demonstrated in earlier works, and, as we demonstrate, yields testable predictions for structure-function and hard-process cross-section ratios. We also note on the non-trivial isospin dependence of the short-range-correlation motivated parametrization, which under proton-neutron pair dominance assumption can lead to charge-symmetry-violation resembling terms.",2025,['Petja Paakkinen'],http://arxiv.org/abs/2510.00252v1,arxiv,,,,,,,2510.00252v1,,False
,,Real-time Anomaly Detection for Liquid Argon Time Projection Chambers,"We present a real-time anomaly detection framework for liquid argon time projection chambers (LArTPCs), targeting applications in particle physics experiments such as the Short Baseline Near Detector (SBND) or the future Deep Underground Neutrino Experiment (DUNE). These experiments employ detectors that generate and stream high-resolution but sparse images of neutrino and other particle interactions. Our approach utilizes anomaly detection with autoencoders, compressed through knowledge distillation (KD), to enable the detection of anomalous signals in the data through efficient inference on resource-constrained hardware. The framework is targeted for deployment on computing platforms equipped with field-programmable gate arrays (FPGAs), GPUs, or CPUs, allowing low-latency selection of relevant activity directly from the raw detector data stream. We demonstrate that our approach is suitable for the detection and localization of anomalously ""high-multiplicity"" activity, and outline promising applications for LArTPC online data filtering and triggering.",2025,"['Seokju Chung', 'Jack Cleeve', 'Akshay Malige', 'Georgia Karagiorgi', 'Lino Gerlach', 'Adrian A. Pol', 'Isobel Ojalvo']",http://arxiv.org/abs/2509.21817v1,arxiv,,,,,,,2509.21817v1,,True
,,"Flavour, Accidentally","We propose a new class of flavour models in which the spurion which breaks Standard Model flavour symmetries transforms in a non-minimal representation. Hierarchies in fermion masses, which arise from multiple insertions of this spurion, may be generated in a technically natural, accidental manner, from a handful of untuned $\mathcal{O}(1)$ elements in the UV. This relies explicitly on the non-Abelian nature of the symmetry, distinguishing it from standard Froggatt-Nielsen-like scenarios. The pattern of flavour violating operators at dimension-6 can radically differ from previously considered scenarios, and emphasises the need for a broad flavour programme across all generations.",2025,"['Hannah Banks', 'Graeme Crawford', 'Matthew McCullough', 'Dave Sutherland']",http://arxiv.org/abs/2510.03403v1,arxiv,,,,,,,2510.03403v1,,False
,,Stable and Interpretable Jet Physics with IRC-Safe Equivariant Feature   Extraction,"Deep learning has achieved remarkable success in jet classification tasks, yet a key challenge remains: understanding what these models learn and how their features relate to known QCD observables. Improving interpretability is essential for building robust and trustworthy machine learning tools in collider physics. To address this challenge, we investigate graph neural networks for quark-gluon discrimination, systematically incorporating physics-motivated inductive biases. In particular, we design message-passing architectures that enforce infrared and collinear (IRC) safety, as well as E(2) and O(2) equivariance in the rapidity-azimuth plane. Using simulated jet datasets, we compare these networks against unconstrained baselines in terms of classification performance, robustness to soft emissions, and latent representation structures. Our analysis shows that physics-aware networks are more stable across training instances and distribute their latent variance across multiple interpretable directions. By regressing Energy Flow Polynomials onto the leading principal components, we establish a direct correspondence between learned representations and established IRC-safe jet observables. These results demonstrate that embedding symmetry and safety constraints not only improves robustness but also grounds network representations in known QCD structures, providing a principled approach toward interpretable deep learning in collider physics.",2025,"['Partha Konar', 'Vishal S. Ngairangbam', 'Michael Spannowsky', 'Deepanshu Srivastava']",http://arxiv.org/abs/2509.22059v1,arxiv,,,,,,,2509.22059v1,,True
,,Wasserstein normalized autoencoder for anomaly detection,"A novel anomaly detection algorithm is presented. The Wasserstein normalized autoencoder (WNAE) is a normalized probabilistic model that minimizes the Wasserstein distance between the learned probability distribution -- a Boltzmann distribution where the energy is the reconstruction error of the autoencoder -- and the distribution of the training data. This algorithm has been developed and applied to the identification of semivisible jets -- conical sprays of visible standard model particles and invisible dark matter states -- with the CMS experiment at the CERN LHC. Trained on jets of particles from simulated standard model processes, the WNAE is shown to learn the probability distribution of the input data in a fully unsupervised fashion, such that it effectively identifies new physics jets as anomalies. The model consistently demonstrates stable, convergent training and achieves strong classification performance across a wide range of signals, improving upon standard normalized autoencoders, while remaining agnostic to the signal. The WNAE directly tackles the problem of outlier reconstruction, a common failure mode of autoencoders in anomaly detection tasks.",2025,['CMS Collaboration'],http://arxiv.org/abs/2510.02168v1,arxiv,,,,,,,2510.02168v1,,True
,,From gauging to duality in one-dimensional quantum lattice models,"Gauging and duality transformations, two of the most useful tools in many-body physics, are shown to be equivalent up to constant depth quantum circuits in the case of one-dimensional quantum lattice models. This is demonstrated by making use of matrix product operators, which provide the lattice representation theory for global (categorical) symmetries as well as a classification of duality transformations. Our construction makes the symmetries of the gauged theory manifest and clarifies how to deal with static background fields when gauging generalised symmetries.",2025,"['Bram Vancraeynest-De Cuiper', 'José Garre-Rubio', 'Frank Verstraete', 'Kevin Vervoort', 'Dominic J. Williamson', 'Laurens Lootens']",http://arxiv.org/abs/2509.22051v1,arxiv,,,,,,,2509.22051v1,,False
,,Machine learning in lattice quantum gravity,"Using numerical data coming from Monte Carlo simulations of four-dimensional Causal Dynamical Triangulations, we study how automated machine learning algorithms can be used to recognize transitions between different phases of quantum geometries observed in lattice quantum gravity. We tested seven supervised and seven unsupervised machine learning models and found that most of them were very successful in that task, even outperforming standard methods based on order parameters.",2025,"['Jan Ambjorn', 'Zbigniew Drogosz', 'Jakub Gizbert-Studnicki', 'Andrzej Görlich', 'Dániel Németh', 'Marcus Reitz']",http://arxiv.org/abs/2510.02159v1,arxiv,,,,,,,2510.02159v1,,True
,,Machine Learning for Event Reconstruction in the CMS Phase-2 High   Granularity Calorimeter Endcap,"The high-luminosity era of the LHC will offer greatly increased number of events for more precise Standard Model measurements and Beyond Standard Model searches, but will also pose unprecedented challenges to the detectors. To meet these challenges, the CMS detector will undergo several upgrades, including the replacement of the current endcap calorimeters with a novel High-Granularity Calorimeter (HGCAL). To make optimal use of this innovative detector, new and original algorithms are being devised. A dedicated reconstruction framework, The Iterative Clustering (TICL), is being developed within the CMS Software (CMSSW). This new framework is designed to fully exploit the high spatial resolution and precise timing information provided by HGCAL. Several key ingredients of the object reconstruction chain already rely on Machine Learning (ML) techniques and their usage is expected to further develop in the future. The existing reconstruction strategies will be presented stressing the role played by ML techniques to exploit the information provided by the detector. The areas where ML techniques are expected to play a role in the future developments will be also discussed.",2025,['Théo Cuisset'],http://arxiv.org/abs/2510.01851v1,arxiv,,,,,,,2510.01851v1,,True
,,Reducing Simulation Dependence in Neutrino Telescopes with Masked Point   Transformers,"Machine learning techniques in neutrino physics have traditionally relied on simulated data, which provides access to ground-truth labels. However, the accuracy of these simulations and the discrepancies between simulated and real data remain significant concerns, particularly for large-scale neutrino telescopes that operate in complex natural media. In recent years, self-supervised learning has emerged as a powerful paradigm for reducing dependence on labeled datasets. Here, we present the first self-supervised training pipeline for neutrino telescopes, leveraging point cloud transformers and masked autoencoders. By shifting the majority of training to real data, this approach minimizes reliance on simulations, thereby mitigating associated systematic uncertainties. This represents a fundamental departure from previous machine learning applications in neutrino telescopes, paving the way for substantial improvements in event reconstruction and classification.",2025,"['Felix J. Yu', 'Nicholas Kamp', 'Carlos A. Argüelles']",http://arxiv.org/abs/2510.01733v1,arxiv,,,,,,,2510.01733v1,,True
,,Temperature derivative divergence of the electric conductivity and   thermal photon emission rate at the critical end point from holography,"The thermal photon emission rate $\frac{d\Gamma}{dk}$ and DC eletric conductivity $\sigma_{Q}$ of the strongly coupled quark-gluon plasma (sQGP) are investigated around the critical end point in a $N_f=2+1$ holographic QCD model with parameters obtained from machine-learning. It is found that both thermal photon emission rate and eletric conductivity grow most obviously around $T_c$, which agrees with the previous studies, and the result of eletric conductivity at zero chemical potential resembles the lattice results. Moreover, it is found that both the temperature derivative of the eletric conductivity and thermal photon emission rate diverge at the critical end point.",2025,"['Yi-Ping Si', 'Danning Li', 'Mei Huang']",http://arxiv.org/abs/2509.25636v1,arxiv,,,,,,,2509.25636v1,,False
,,Automating Sensor Characterization with Bayesian Optimization,"The development of novel instrumentation requires an iterative cycle with three stages: design, prototyping, and testing. Recent advancements in simulation and nanofabrication techniques have significantly accelerated the design and prototyping phases. Nonetheless, detector characterization continues to be a major bottleneck in device development. During the testing phase, a significant time investment is required to characterize the device in different operating conditions and find optimal operating parameters. The total effort spent on characterization and parameter optimization can occupy a year or more of an expert's time. In this work, we present a novel technique for automated sensor calibration that aims to accelerate the testing stage of the development cycle. This technique leverages closed-loop Bayesian optimization (BO), using real-time measurements to guide parameter selection and identify optimal operating states. We demonstrate the method with a novel low-noise CCD, showing that the machine learning-driven tool can efficiently characterize and optimize operation of the sensor in a couple of days without supervision of a device expert.",2025,"['J. Cuevas-Zepeda', 'C. Chavez', 'J. Estrada', 'J. Noonan', 'B. D. Nord', 'N. Saffold', 'M. Sofo-Haro', 'R. Spinola e Castro', 'S. Trivedi']",http://arxiv.org/abs/2509.21661v1,arxiv,,,,,,,2509.21661v1,,True
,,Addressing the sign-problem in Euclidean path integrals with radial   basis function neural networks,"Solving interacting field theories at finite densities remains a numerically and conceptually challenging task, even with modern computational capabilities. In this paper, we propose a novel approach based on an expansion of the Euclidean path integrals using radial basis function neural networks, which allows the calculation of observables at finite densities and overcomes the sign problem in a numerically very efficient manner. The method is applied to an interacting complex scalar field theory at finite chemical potential in 3+1 dimensions, which exhibits both the sign problem and the silver blaze phenomenon, similar to QCD. The critical chemical potential at which phase transition occurs is estimated to be $\mu_c=1.17 \pm 0.018$, and the silver blaze problem is accurately described below $\mu_c$.",2025,['Gabor Balassa'],http://arxiv.org/abs/2510.01695v2,arxiv,,,,,,,2510.01695v2,,True
,,Dirac QNM spectrum from twisted semiclassical gauge theory of gravity,"Twisted Abelian gauge theory coupled to a noncommutative (NC) Dirac field is studied in order to infer   the quasinormal mode (QNM) spectrum of the fermion matter perturbations in the vicinity of the Reissner-Nordstr\""om (RN) black hole. The action functional of the theory is invariant under the truncated NC local $U(1)_{\star}$ gauge transformations that keep the gravitational background intact. The latter, being a classical gravitational background unaffected by the   NC local gauge transformations, makes the theory semiclassical. The most prominent feature of the QNM spectrum is the splitting in the total angular momentum projection due to the noncommutativity induced $SO(3) \rightarrow U(1)$ symmetry breaking pattern.",2025,"['Marija Dimitrijević Ćirić', 'Nikola Herceg', 'Nikola Konjik', 'A. Naveena Kumara', 'Andjelo Samsarov']",http://arxiv.org/abs/2509.21620v1,arxiv,,,,,,,2509.21620v1,,False
,,Gravitational wave experiments: achievements and plans,"Gravitational wave (GW) experiments have transformed our understanding of the Universe by enabling direct observations of compact object mergers and other astrophysical phenomena. This chapter reviews the concepts of GW detectors, such as LIGO, Virgo, and KAGRA, and describes their operating principles, data acquisition and analysis techniques, and some of the methods used to extract source properties. The scientific impact of GW observations is discussed as well, including contributions to astrophysics, tests of general relativity, and cosmology. We also examine the role of multimessenger astronomy and the complementarity between different GW detectors and with other astroparticle experiments. Finally, we outline future prospects with next-generation detectors, like the Einstein Telescope and Cosmic Explorer, and space-based missions.",2025,"['Elisa Bigongiari', 'Matteo Di Giovanni', 'Giovanni Losurdo']",http://arxiv.org/abs/2509.25952v2,arxiv,,,,,,,2509.25952v2,,False
,,Foundation models for high-energy physics,"The rise of foundation models -- large, pretrained machine learning models that can be finetuned to a variety of tasks -- has revolutionized the fields of natural language processing and computer vision. In high-energy physics, the question of whether these models can be implemented directly in physics research, or even built from scratch, tailored for particle physics data, has generated an increasing amount of attention. This review, which is the first on the topic of foundation models in high-energy physics, summarizes and discusses the research that has been published in the field so far.",2025,['Anna Hallin'],http://arxiv.org/abs/2509.21434v1,arxiv,,,,,,,2509.21434v1,,True
,,Primordial black holes formation in inflationary $F(R)$ models with   scalar fields,"We construct $F(R)$ gravity models with scalar fields to describe cosmological inflation and formation of primordial black holes (PBHs). By adding the induced gravity term and the fourth-order polynomial potential for the scalar field to the known $F(R)$ gravity model, and using a conformal transformation of the metric, we obtain a two-field chiral cosmological model. For some values of the model parameters, we get that the inflationary parameters of this model are in good agreement with the observations of the cosmic microwave background radiation obtained by the Atacama Cosmology Telescope. The estimation of PBH masses suggests that PBHs could be dark matter candidates.",2025,"['E. O. Pozdeeva', 'S. Yu. Vernov']",http://arxiv.org/abs/2509.21220v1,arxiv,,,,,,,2509.21220v1,,False
